{
  "schema_version": "taskplan-pro.operation-map/v1",
  "graph_id": "taskplan-pro-operation-map-self-hosted",
  "graph_version": "0.2.1",
  "status": "ready",
  "canonical_source": "examples/self-hosted/OPERATION-MAP.json",
  "concept_source": {
    "path": "examples/self-hosted/CONCEPT.md",
    "sha256": "641454257e424f9202710d73612f07e7d3e9cb27fa06c7ce2233e6046c64a414",
    "sections": {
      "C01": {
        "id": "C01",
        "title": "Vendor-neutral agent skill and TASK-PLAN PRO module",
        "anchor": "c01-vendor-neutral-agent-skill-and-task-plan-pro-module",
        "required": true
      },
      "C02": {
        "id": "C02",
        "title": "Accepted concept to validated operation graph",
        "anchor": "c02-accepted-concept-to-validated-operation-graph",
        "required": true
      },
      "C03": {
        "id": "C03",
        "title": "Deterministic review projections",
        "anchor": "c03-deterministic-review-projections",
        "required": true
      },
      "C04": {
        "id": "C04",
        "title": "Evidence honesty and scope boundary",
        "anchor": "c04-evidence-honesty-and-scope-boundary",
        "required": true
      }
    }
  },
  "blocks": [
    {
      "id": "B01",
      "order": 1,
      "title": "Build and validate the operation graph",
      "implements": ["C01", "C02", "C04"],
      "implementation_status": "implemented",
      "implementation_evidence": [
        "skill/SKILL.md",
        "skill/scripts/operation_map.py",
        "skill/contracts/operation-map.schema.json",
        "skill/tests/test_operation_map.py"
      ],
      "main_output": "Source-bound canonical operation graph and passing readiness audit",
      "next_block": "B02"
    },
    {
      "id": "B02",
      "order": 2,
      "title": "Generate and review deterministic projections",
      "implements": ["C01", "C03", "C04"],
      "implementation_status": "implemented",
      "implementation_evidence": [
        "skill/scripts/review_workspace.py",
        "skill/references/review-workspace-contract.md",
        "skill/tests/test_operation_map.py",
        "package.json"
      ],
      "main_output": "Self-contained local review workspace and hash-bound build manifest",
      "next_block": null
    }
  ],
  "nodes": [
    {
      "id": "B01",
      "type": "block",
      "title": "Build and validate the operation graph",
      "parent_id": null,
      "implements": ["C01", "C02", "C04"],
      "implementation_status": "implemented",
      "implementation_evidence": ["skill/scripts/operation_map.py", "skill/tests/test_operation_map.py"],
      "operational_fields": {
        "what": "A compatible coding agent decomposes an accepted concept into canonical graph data, and the CLI validates structure, meaning, traceability, routes, and source identity.",
        "where": "The agent skill operates in the user's coding environment; deterministic validation runs locally through the packaged Python engine.",
        "when": "This block starts after the product owner identifies and accepts the current concept version.",
        "why": "It prevents attractive diagrams or oversized implementation tasks from hiding missing product meaning and broken transitions.",
        "input": "An accepted product concept, a target graph path, repository evidence, and explicit output boundaries.",
        "input_requirements": "The concept is readable, version-identifiable, owner-accepted, and free of unresolved meaning that only the owner can decide.",
        "expected_output": "A canonical operation graph bound to the concept hash plus an audit with a deterministic readiness verdict.",
        "success_criteria": "The validator exits zero, reports ready true, covers every required concept section, and finds no missing gate or failure route.",
        "failure_criteria": "Validation finds a semantic gap, traceability gap, source mismatch, invalid route, unsupported implementation claim, or malformed graph.",
        "failure_action": "Return only the affected graph fragment to the responsible agent or return an owner-owned semantic decision to the product owner.",
        "executor": "Compatible coding agent using the TASKPLAN PRO Operation Map skill and local CLI.",
        "reviewer": "Independent concept and graph reviewer.",
        "acceptor": "Product owner for meaning and deterministic validator for structural readiness.",
        "resources": "Published skill directory, Python 3.10 or newer, repository evidence, and operation-map contracts.",
        "evidence": "Canonical graph hash, concept hash, readiness audit, validator exit code, and repository paths supporting implementation claims.",
        "next_transition": "A passing readiness gate admits the exact graph bytes to deterministic projection generation."
      }
    },
    {
      "id": "B01-A01",
      "type": "artifact",
      "title": "Validated canonical operation graph",
      "parent_id": "B01",
      "implements": ["C02", "C04"],
      "implementation_status": "implemented",
      "implementation_evidence": ["skill/contracts/operation-map.schema.json", "skill/scripts/operation_map.py"],
      "artifact_contract": {
        "producer": "B01",
        "reviewer": "Independent concept and graph reviewer",
        "consumers": ["B01-G01", "B02"]
      }
    },
    {
      "id": "B01-G01",
      "type": "gate",
      "title": "Graph readiness gate",
      "parent_id": "B01",
      "implements": ["C02", "C04"],
      "implementation_status": "implemented",
      "implementation_evidence": ["skill/references/graph-readiness-gate.md", "skill/tests/test_operation_map.py"],
      "operational_fields": {
        "what": "Validate the exact canonical graph against the accepted concept and closed readiness rules.",
        "where": "Inside the local operation-map validator before any review projection is generated.",
        "when": "After graph authoring or any correction changes canonical graph bytes.",
        "why": "Derived views must never make an incomplete or stale graph appear ready for downstream work.",
        "input": "Canonical graph JSON, accepted concept bytes, declared section registry, and repository evidence references.",
        "input_requirements": "Graph and concept hashes resolve, required fields are populated, and all referenced IDs and evidence paths are attributable.",
        "expected_output": "A source-bound audit that reports ready true or lists exact blocking findings.",
        "success_criteria": "The audit contains zero errors and the validation process exits with code zero.",
        "failure_criteria": "Any structural, semantic, traceability, routing, evidence, or source-identity error remains.",
        "failure_action": "Route the exact finding to B01-F01 and correct only the narrowest responsible source or request an owner decision.",
        "executor": "Local deterministic operation-map validator.",
        "reviewer": "Independent graph reviewer verifies that passing structure does not overstate product truth.",
        "acceptor": "Readiness policy encoded by the packaged validator.",
        "resources": "operation_map.py, operation-map schema, accepted concept, and canonical graph.",
        "evidence": "Validator exit code and OPERATION-MAP-AUDIT.json bound to graph and concept hashes.",
        "next_transition": "Success unblocks B02; failure opens B01-F01."
      }
    },
    {
      "id": "B01-F01",
      "type": "failure",
      "title": "Graph or concept readiness failure",
      "parent_id": "B01",
      "implements": ["C02", "C04"],
      "implementation_status": "implemented",
      "implementation_evidence": ["skill/references/failure-modes.md", "skill/scripts/operation_map.py"],
      "operational_fields": {
        "what": "Preserve the failed verdict and identify the narrowest graph, evidence, or owner-decision boundary responsible for it.",
        "where": "The audit report and agent handoff for the current graph revision.",
        "when": "Whenever the readiness gate returns one or more blocking errors.",
        "why": "A visible correction route prevents silent retries, invented product meaning, and unrelated scope expansion.",
        "input": "Failed readiness audit with stable finding codes and affected paths.",
        "input_requirements": "Findings retain graph identity, source hashes, and exact paths; no error is replaced by a generic retry request.",
        "expected_output": "A bounded correction to the responsible graph fragment or an explicit unresolved owner decision.",
        "success_criteria": "The responsible boundary is identified and the next validation run uses corrected, source-consistent inputs.",
        "failure_criteria": "The agent invents missing semantics, changes unrelated scope, or retries without addressing the recorded finding.",
        "failure_action": "Stop automated correction and return to B01 with the unresolved finding and required authority named.",
        "executor": "Responsible coding agent or product owner according to the finding type.",
        "reviewer": "Independent concept and graph reviewer.",
        "acceptor": "Product owner for semantic corrections and validator for mechanical corrections.",
        "resources": "Failed audit, canonical sources, repository evidence, and bounded correction policy.",
        "evidence": "Before-and-after source hashes, resolved finding codes, and the subsequent validator result.",
        "next_transition": "Return to B01 and rerun readiness after the bounded correction is complete."
      }
    },
    {
      "id": "B02",
      "type": "block",
      "title": "Generate and review deterministic projections",
      "parent_id": null,
      "implements": ["C01", "C03", "C04"],
      "implementation_status": "implemented",
      "implementation_evidence": ["skill/scripts/review_workspace.py", "skill/tests/test_operation_map.py"],
      "operational_fields": {